{
  "id": "monokai",
  "name": "monokai",
  "displayName": "Monokai",
  "version": "1.0.0",
  "type": "dark",
  "description": "Monokai (by monokai) theme adapted for Tengra.",
  "author": "monokai",
  "colors": {
    "background": "70 8% 15%",
    "foreground": "60 30% 96%",
    "card": "70 8% 15%",
    "cardForeground": "60 30% 96%",
    "popover": "70 8% 15%",
    "popoverForeground": "60 30% 96%",
    "primary": "326 100% 74%",
    "primaryForeground": "0 0% 0%",
    "secondary": "70 8% 15%",
    "secondaryForeground": "60 30% 96%",
    "accent": "326 100% 74%",
    "accentForeground": "70 8% 15%",
    "destructive": "0 84% 60%",
    "destructiveForeground": "0 0% 100%",
    "muted": "0 0% 20%",
    "mutedForeground": "60 30% 96%",
    "border": "0 0% 30%",
    "input": "0 0% 30%",
    "ring": "326 100% 74%"
  }
}