{
  "id": "gruvbox-dark",
  "name": "gruvbox-dark",
  "displayName": "Gruvbox Dark",
  "version": "1.0.0",
  "type": "dark",
  "description": "Gruvbox Dark (by morhetz) theme adapted for Tengra.",
  "author": "morhetz",
  "colors": {
    "background": "30 8% 20%",
    "foreground": "45 20% 82%",
    "card": "30 8% 20%",
    "cardForeground": "45 20% 82%",
    "popover": "30 8% 20%",
    "popoverForeground": "45 20% 82%",
    "primary": "28 65% 55%",
    "primaryForeground": "0 0% 0%",
    "secondary": "30 8% 20%",
    "secondaryForeground": "45 20% 82%",
    "accent": "28 65% 55%",
    "accentForeground": "30 8% 20%",
    "destructive": "0 84% 60%",
    "destructiveForeground": "0 0% 100%",
    "muted": "0 0% 20%",
    "mutedForeground": "45 20% 82%",
    "border": "0 0% 30%",
    "input": "0 0% 30%",
    "ring": "28 65% 55%"
  }
}