{
  "id": "cobalt2",
  "name": "cobalt2",
  "displayName": "Cobalt2",
  "version": "1.0.0",
  "type": "dark",
  "description": "Cobalt2 (by Wes Bos) theme adapted for Tengra.",
  "author": "Wes Bos",
  "colors": {
    "background": "210 43% 16%",
    "foreground": "60 30% 96%",
    "card": "210 43% 16%",
    "cardForeground": "60 30% 96%",
    "popover": "210 43% 16%",
    "popoverForeground": "60 30% 96%",
    "primary": "45 100% 51%",
    "primaryForeground": "0 0% 0%",
    "secondary": "210 43% 16%",
    "secondaryForeground": "60 30% 96%",
    "accent": "45 100% 51%",
    "accentForeground": "210 43% 16%",
    "destructive": "0 84% 60%",
    "destructiveForeground": "0 0% 100%",
    "muted": "0 0% 20%",
    "mutedForeground": "60 30% 96%",
    "border": "0 0% 30%",
    "input": "0 0% 30%",
    "ring": "45 100% 51%"
  }
}